{"all_required_work_accounted":true,"all_required_work_verified":true,"attempts":[{"at":1790263418.1878076,"epoch":1,"id":"729362fcd2804cd6b21c41dcd4d3b602","phase":"TARGET_COMMITTED","work":"1b3a3c14159d47deab8b4e5e597231ab"},{"at":1790263418.4512026,"epoch":2,"id":"edc71fc9e5ca4475b858445089df050e","phase":"TARGET_COMMITTED","work":"2f4d1d7dd56842bdb447b479973918a3"}],"dependencies":[],"disposition_checks":{"1b3a3c14159d47deab8b4e5e597231ab":true,"2f4d1d7dd56842bdb447b479973918a3":true},"events":[{"at":1790263417.9382744,"body":"{\"grant\":\"44f76f905fea45dbad9a1acae4a1bae8\",\"max_effects\":1,\"target\":\"original\",\"tenant\":\"synthetic\"}","id":1,"kind":"operator_grant"},{"at":1790263417.9494812,"body":"{\"grant\":\"44f76f905fea45dbad9a1acae4a1bae8\",\"payload_hash\":\"3e043eef46e1b33f2389ab60efe8bb23e24f0729e4bcd16db7ef7fe0c8cb7382\",\"profile\":\"local-atomic\",\"work\":\"1b3a3c14159d47deab8b4e5e597231ab\"}","id":2,"kind":"admitted"},{"at":1790263417.9593356,"body":"{\"grant\":\"694113eb7b3a447f8aaf9b22e31307a3\",\"max_effects\":1,\"target\":\"z-independent\",\"tenant\":\"synthetic\"}","id":3,"kind":"operator_grant"},{"at":1790263417.9711723,"body":"{\"grant\":\"694113eb7b3a447f8aaf9b22e31307a3\",\"payload_hash\":\"3e043eef46e1b33f2389ab60efe8bb23e24f0729e4bcd16db7ef7fe0c8cb7382\",\"profile\":\"local-atomic\",\"work\":\"2f4d1d7dd56842bdb447b479973918a3\"}","id":4,"kind":"admitted"},{"at":1790263418.1716106,"body":"{\"epoch\":1,\"worker\":\"controller-1\"}","id":5,"kind":"claim"},{"at":1790263418.1878076,"body":"{\"attempt\":\"729362fcd2804cd6b21c41dcd4d3b602\",\"epoch\":1,\"work\":\"1b3a3c14159d47deab8b4e5e597231ab\"}","id":6,"kind":"dispatch_intent"},{"at":1790263418.4079955,"body":"{\"epoch\":1}","id":7,"kind":"operator_stop"},{"at":1790263418.4215772,"body":"{\"epoch\":2,\"worker\":\"controller-2\"}","id":8,"kind":"claim"},{"at":1790263418.436838,"body":"{\"state\":\"VERIFIED\",\"work\":\"1b3a3c14159d47deab8b4e5e597231ab\"}","id":9,"kind":"reconciled"},{"at":1790263418.4512026,"body":"{\"attempt\":\"edc71fc9e5ca4475b858445089df050e\",\"epoch\":2,\"work\":\"2f4d1d7dd56842bdb447b479973918a3\"}","id":10,"kind":"dispatch_intent"},{"at":1790263418.4743078,"body":"{\"state\":\"VERIFIED\",\"work\":\"2f4d1d7dd56842bdb447b479973918a3\"}","id":11,"kind":"reconciled"},{"at":1790263418.4892256,"body":"{\"name\":\"complete-result\"}","id":12,"kind":"result_reservation"}],"export_is_remote_delivery":false,"export_target_checks":{"1b3a3c14159d47deab8b4e5e597231ab":true,"2f4d1d7dd56842bdb447b479973918a3":true},"grants":[{"expires":1790267017.9302115,"id":"44f76f905fea45dbad9a1acae4a1bae8","max_delta":10,"max_effects":1,"revoked":0,"target":"original","tenant":"synthetic"},{"expires":1790267017.9593356,"id":"694113eb7b3a447f8aaf9b22e31307a3","max_delta":10,"max_effects":1,"revoked":0,"target":"z-independent","tenant":"synthetic"}],"limits":["Local trusted operator and filesystem","No remote exactly-once guarantee","Foreground service has no future wake unless invoked"],"node":"8162951fff0b4a709bd29c1b7c7623ed","observations":[{"at":1790263418.436838,"evidence":"{\"at\":1790263418.2016535,\"delta\":1,\"epoch\":1,\"id\":\"1b3a3c14159d47deab8b4e5e597231ab\",\"payload_hash\":\"3e043eef46e1b33f2389ab60efe8bb23e24f0729e4bcd16db7ef7fe0c8cb7382\",\"target\":\"original\",\"tenant\":\"synthetic\"}","id":1,"kind":"VERIFIED","work":"1b3a3c14159d47deab8b4e5e597231ab"},{"at":1790263418.4743078,"evidence":"{\"at\":1790263418.4595783,\"delta\":1,\"epoch\":2,\"id\":\"2f4d1d7dd56842bdb447b479973918a3\",\"payload_hash\":\"3e043eef46e1b33f2389ab60efe8bb23e24f0729e4bcd16db7ef7fe0c8cb7382\",\"target\":\"z-independent\",\"tenant\":\"synthetic\"}","id":2,"kind":"VERIFIED","work":"2f4d1d7dd56842bdb447b479973918a3"}],"owner":{"epoch":2,"singleton":1,"stopped":0,"worker":"controller-2"},"schema":1,"snapshot_at":1790263418.4972808,"target_effects":[{"at":1790263418.2016535,"delta":1,"epoch":1,"id":"1b3a3c14159d47deab8b4e5e597231ab","payload_hash":"3e043eef46e1b33f2389ab60efe8bb23e24f0729e4bcd16db7ef7fe0c8cb7382","target":"original","tenant":"synthetic"},{"at":1790263418.4595783,"delta":1,"epoch":2,"id":"2f4d1d7dd56842bdb447b479973918a3","payload_hash":"3e043eef46e1b33f2389ab60efe8bb23e24f0729e4bcd16db7ef7fe0c8cb7382","target":"z-independent","tenant":"synthetic"}],"waits":[],"works":[{"attempts":1,"budget":3,"deadline":1790263717.9494812,"grant_id":"44f76f905fea45dbad9a1acae4a1bae8","id":"1b3a3c14159d47deab8b4e5e597231ab","payload":"{\"delta\":1,\"operation\":\"increment\"}","payload_hash":"3e043eef46e1b33f2389ab60efe8bb23e24f0729e4bcd16db7ef7fe0c8cb7382","profile":"local-atomic","state":"VERIFIED","target":"original","tenant":"synthetic"},{"attempts":1,"budget":3,"deadline":1790263717.9698155,"grant_id":"694113eb7b3a447f8aaf9b22e31307a3","id":"2f4d1d7dd56842bdb447b479973918a3","payload":"{\"delta\":1,\"operation\":\"increment\"}","payload_hash":"3e043eef46e1b33f2389ab60efe8bb23e24f0729e4bcd16db7ef7fe0c8cb7382","profile":"local-atomic","state":"VERIFIED","target":"z-independent","tenant":"synthetic"}]}
