{"all_required_work_accounted":true,"all_required_work_verified":true,"attempts":[{"at":1790263418.9092374,"epoch":1,"id":"c5d27f50529644bcbe6e47dd0bf0c080","phase":"TARGET_COMMITTED","work":"fc96a8d014d74508835dc0dfd30eaf27"},{"at":1790263419.3267844,"epoch":3,"id":"09ed4bc120bc4f4c84aaf1d75c1b3c26","phase":"TARGET_COMMITTED","work":"258a59dee1254532bb3e232fc9d55f73"}],"dependencies":[],"disposition_checks":{"258a59dee1254532bb3e232fc9d55f73":true,"fc96a8d014d74508835dc0dfd30eaf27":true},"events":[{"at":1790263418.681737,"body":"{\"grant\":\"24e34e28eb1d4995b61d606233ba4005\",\"max_effects\":1,\"target\":\"original\",\"tenant\":\"synthetic\"}","id":1,"kind":"operator_grant"},{"at":1790263418.692529,"body":"{\"grant\":\"24e34e28eb1d4995b61d606233ba4005\",\"payload_hash\":\"3e043eef46e1b33f2389ab60efe8bb23e24f0729e4bcd16db7ef7fe0c8cb7382\",\"profile\":\"local-atomic\",\"work\":\"fc96a8d014d74508835dc0dfd30eaf27\"}","id":2,"kind":"admitted"},{"at":1790263418.70349,"body":"{\"grant\":\"340192b577f544c68b09eea19f02e808\",\"max_effects\":1,\"target\":\"z-independent\",\"tenant\":\"synthetic\"}","id":3,"kind":"operator_grant"},{"at":1790263418.7135615,"body":"{\"grant\":\"340192b577f544c68b09eea19f02e808\",\"payload_hash\":\"3e043eef46e1b33f2389ab60efe8bb23e24f0729e4bcd16db7ef7fe0c8cb7382\",\"profile\":\"local-atomic\",\"work\":\"258a59dee1254532bb3e232fc9d55f73\"}","id":4,"kind":"admitted"},{"at":1790263418.8962007,"body":"{\"epoch\":1,\"worker\":\"controller-1\"}","id":5,"kind":"claim"},{"at":1790263418.9092374,"body":"{\"attempt\":\"c5d27f50529644bcbe6e47dd0bf0c080\",\"epoch\":1,\"work\":\"fc96a8d014d74508835dc0dfd30eaf27\"}","id":6,"kind":"dispatch_intent"},{"at":1790263419.1012218,"body":"{\"epoch\":1}","id":7,"kind":"operator_stop"},{"at":1790263419.1102862,"body":"{\"epoch\":2,\"worker\":\"controller-2\"}","id":8,"kind":"claim"},{"at":1790263419.1252842,"body":"{\"state\":\"VERIFIED\",\"work\":\"fc96a8d014d74508835dc0dfd30eaf27\"}","id":9,"kind":"reconciled"},{"at":1790263419.2998533,"body":"{\"epoch\":2}","id":10,"kind":"operator_stop"},{"at":1790263419.3086054,"body":"{\"epoch\":3,\"worker\":\"controller-3\"}","id":11,"kind":"claim"},{"at":1790263419.3267844,"body":"{\"attempt\":\"09ed4bc120bc4f4c84aaf1d75c1b3c26\",\"epoch\":3,\"work\":\"258a59dee1254532bb3e232fc9d55f73\"}","id":12,"kind":"dispatch_intent"},{"at":1790263419.3525321,"body":"{\"state\":\"VERIFIED\",\"work\":\"258a59dee1254532bb3e232fc9d55f73\"}","id":13,"kind":"reconciled"},{"at":1790263419.3671663,"body":"{\"name\":\"complete-result\"}","id":14,"kind":"result_reservation"}],"export_is_remote_delivery":false,"export_target_checks":{"258a59dee1254532bb3e232fc9d55f73":true,"fc96a8d014d74508835dc0dfd30eaf27":true},"grants":[{"expires":1790267018.680738,"id":"24e34e28eb1d4995b61d606233ba4005","max_delta":10,"max_effects":1,"revoked":0,"target":"original","tenant":"synthetic"},{"expires":1790267018.702483,"id":"340192b577f544c68b09eea19f02e808","max_delta":10,"max_effects":1,"revoked":0,"target":"z-independent","tenant":"synthetic"}],"limits":["Local trusted operator and filesystem","No remote exactly-once guarantee","Foreground service has no future wake unless invoked"],"node":"e8e9c1c31226417dbc73f8d4028aa813","observations":[{"at":1790263419.1252842,"evidence":"{\"at\":1790263418.9182522,\"delta\":1,\"epoch\":1,\"id\":\"fc96a8d014d74508835dc0dfd30eaf27\",\"payload_hash\":\"3e043eef46e1b33f2389ab60efe8bb23e24f0729e4bcd16db7ef7fe0c8cb7382\",\"target\":\"original\",\"tenant\":\"synthetic\"}","id":1,"kind":"VERIFIED","work":"fc96a8d014d74508835dc0dfd30eaf27"},{"at":1790263419.3525321,"evidence":"{\"at\":1790263419.3357852,\"delta\":1,\"epoch\":3,\"id\":\"258a59dee1254532bb3e232fc9d55f73\",\"payload_hash\":\"3e043eef46e1b33f2389ab60efe8bb23e24f0729e4bcd16db7ef7fe0c8cb7382\",\"target\":\"z-independent\",\"tenant\":\"synthetic\"}","id":2,"kind":"VERIFIED","work":"258a59dee1254532bb3e232fc9d55f73"}],"owner":{"epoch":3,"singleton":1,"stopped":0,"worker":"controller-3"},"schema":1,"snapshot_at":1790263419.3756607,"target_effects":[{"at":1790263418.9182522,"delta":1,"epoch":1,"id":"fc96a8d014d74508835dc0dfd30eaf27","payload_hash":"3e043eef46e1b33f2389ab60efe8bb23e24f0729e4bcd16db7ef7fe0c8cb7382","target":"original","tenant":"synthetic"},{"at":1790263419.3357852,"delta":1,"epoch":3,"id":"258a59dee1254532bb3e232fc9d55f73","payload_hash":"3e043eef46e1b33f2389ab60efe8bb23e24f0729e4bcd16db7ef7fe0c8cb7382","target":"z-independent","tenant":"synthetic"}],"waits":[],"works":[{"attempts":1,"budget":3,"deadline":1790263718.691524,"grant_id":"24e34e28eb1d4995b61d606233ba4005","id":"fc96a8d014d74508835dc0dfd30eaf27","payload":"{\"delta\":1,\"operation\":\"increment\"}","payload_hash":"3e043eef46e1b33f2389ab60efe8bb23e24f0729e4bcd16db7ef7fe0c8cb7382","profile":"local-atomic","state":"VERIFIED","target":"original","tenant":"synthetic"},{"attempts":1,"budget":3,"deadline":1790263718.7125585,"grant_id":"340192b577f544c68b09eea19f02e808","id":"258a59dee1254532bb3e232fc9d55f73","payload":"{\"delta\":1,\"operation\":\"increment\"}","payload_hash":"3e043eef46e1b33f2389ab60efe8bb23e24f0729e4bcd16db7ef7fe0c8cb7382","profile":"local-atomic","state":"VERIFIED","target":"z-independent","tenant":"synthetic"}]}
