{
  "schema": 1,
  "node": "0e5538ce8a024e5d87cb97e83f4cfbab",
  "owner": {
    "singleton": 1,
    "epoch": 3,
    "worker": "controller-3",
    "stopped": 0
  },
  "works": [
    {
      "id": "5f6f4ec333cf43d2a4bcafd3fe9e5779",
      "grant_id": "832d1651c6794217adf1a0a392a2449b",
      "tenant": "synthetic",
      "target": "original",
      "payload": "{\"delta\":1,\"operation\":\"increment\"}",
      "payload_hash": "3e043eef46e1b33f2389ab60efe8bb23e24f0729e4bcd16db7ef7fe0c8cb7382",
      "state": "VERIFIED",
      "attempts": 1,
      "budget": 3,
      "deadline": 1790263719.554358,
      "profile": "local-atomic"
    },
    {
      "id": "9c02c1aa976540938e1de9a3091c6fb0",
      "grant_id": "8cf53d9d6ca9480c8e72cf30ac895781",
      "tenant": "synthetic",
      "target": "z-independent",
      "payload": "{\"delta\":1,\"operation\":\"increment\"}",
      "payload_hash": "3e043eef46e1b33f2389ab60efe8bb23e24f0729e4bcd16db7ef7fe0c8cb7382",
      "state": "VERIFIED",
      "attempts": 1,
      "budget": 3,
      "deadline": 1790263719.5737386,
      "profile": "local-atomic"
    }
  ],
  "grants": [
    {
      "id": "832d1651c6794217adf1a0a392a2449b",
      "tenant": "synthetic",
      "target": "original",
      "max_delta": 10,
      "max_effects": 1,
      "expires": 1790267019.5431094,
      "revoked": 0
    },
    {
      "id": "8cf53d9d6ca9480c8e72cf30ac895781",
      "tenant": "synthetic",
      "target": "z-independent",
      "max_delta": 10,
      "max_effects": 1,
      "expires": 1790267019.5633245,
      "revoked": 0
    }
  ],
  "attempts": [
    {
      "id": "2b8c044d595b4c62b84cb094f415bf30",
      "work": "5f6f4ec333cf43d2a4bcafd3fe9e5779",
      "epoch": 1,
      "phase": "TARGET_COMMITTED",
      "at": 1790263419.7743604
    },
    {
      "id": "290892171ef8402487076f60d5508192",
      "work": "9c02c1aa976540938e1de9a3091c6fb0",
      "epoch": 3,
      "phase": "TARGET_COMMITTED",
      "at": 1790263420.2018404
    }
  ],
  "observations": [
    {
      "id": 1,
      "work": "5f6f4ec333cf43d2a4bcafd3fe9e5779",
      "kind": "VERIFIED",
      "evidence": "{\"at\":1790263419.783167,\"delta\":1,\"epoch\":1,\"id\":\"5f6f4ec333cf43d2a4bcafd3fe9e5779\",\"payload_hash\":\"3e043eef46e1b33f2389ab60efe8bb23e24f0729e4bcd16db7ef7fe0c8cb7382\",\"target\":\"original\",\"tenant\":\"synthetic\"}",
      "at": 1790263419.9915824
    },
    {
      "id": 2,
      "work": "9c02c1aa976540938e1de9a3091c6fb0",
      "kind": "VERIFIED",
      "evidence": "{\"at\":1790263420.2109601,\"delta\":1,\"epoch\":3,\"id\":\"9c02c1aa976540938e1de9a3091c6fb0\",\"payload_hash\":\"3e043eef46e1b33f2389ab60efe8bb23e24f0729e4bcd16db7ef7fe0c8cb7382\",\"target\":\"z-independent\",\"tenant\":\"synthetic\"}",
      "at": 1790263420.2266438
    }
  ],
  "dependencies": [],
  "waits": [],
  "events": [
    {
      "id": 1,
      "kind": "operator_grant",
      "body": "{\"grant\":\"832d1651c6794217adf1a0a392a2449b\",\"max_effects\":1,\"target\":\"original\",\"tenant\":\"synthetic\"}",
      "at": 1790263419.5441108
    },
    {
      "id": 2,
      "kind": "admitted",
      "body": "{\"grant\":\"832d1651c6794217adf1a0a392a2449b\",\"payload_hash\":\"3e043eef46e1b33f2389ab60efe8bb23e24f0729e4bcd16db7ef7fe0c8cb7382\",\"profile\":\"local-atomic\",\"work\":\"5f6f4ec333cf43d2a4bcafd3fe9e5779\"}",
      "at": 1790263419.554358
    },
    {
      "id": 3,
      "kind": "operator_grant",
      "body": "{\"grant\":\"8cf53d9d6ca9480c8e72cf30ac895781\",\"max_effects\":1,\"target\":\"z-independent\",\"tenant\":\"synthetic\"}",
      "at": 1790263419.564324
    },
    {
      "id": 4,
      "kind": "admitted",
      "body": "{\"grant\":\"8cf53d9d6ca9480c8e72cf30ac895781\",\"payload_hash\":\"3e043eef46e1b33f2389ab60efe8bb23e24f0729e4bcd16db7ef7fe0c8cb7382\",\"profile\":\"local-atomic\",\"work\":\"9c02c1aa976540938e1de9a3091c6fb0\"}",
      "at": 1790263419.574747
    },
    {
      "id": 5,
      "kind": "claim",
      "body": "{\"epoch\":1,\"worker\":\"controller-1\"}",
      "at": 1790263419.7600434
    },
    {
      "id": 6,
      "kind": "dispatch_intent",
      "body": "{\"attempt\":\"2b8c044d595b4c62b84cb094f415bf30\",\"epoch\":1,\"work\":\"5f6f4ec333cf43d2a4bcafd3fe9e5779\"}",
      "at": 1790263419.7743604
    },
    {
      "id": 7,
      "kind": "operator_stop",
      "body": "{\"epoch\":1}",
      "at": 1790263419.9695878
    },
    {
      "id": 8,
      "kind": "claim",
      "body": "{\"epoch\":2,\"worker\":\"controller-2\"}",
      "at": 1790263419.9786186
    },
    {
      "id": 9,
      "kind": "reconciled",
      "body": "{\"state\":\"VERIFIED\",\"work\":\"5f6f4ec333cf43d2a4bcafd3fe9e5779\"}",
      "at": 1790263419.9915824
    },
    {
      "id": 10,
      "kind": "operator_stop",
      "body": "{\"epoch\":2}",
      "at": 1790263420.1743383
    },
    {
      "id": 11,
      "kind": "claim",
      "body": "{\"epoch\":3,\"worker\":\"controller-3\"}",
      "at": 1790263420.1840622
    },
    {
      "id": 12,
      "kind": "dispatch_intent",
      "body": "{\"attempt\":\"290892171ef8402487076f60d5508192\",\"epoch\":3,\"work\":\"9c02c1aa976540938e1de9a3091c6fb0\"}",
      "at": 1790263420.2018404
    },
    {
      "id": 13,
      "kind": "reconciled",
      "body": "{\"state\":\"VERIFIED\",\"work\":\"9c02c1aa976540938e1de9a3091c6fb0\"}",
      "at": 1790263420.2266438
    },
    {
      "id": 14,
      "kind": "result_reservation",
      "body": "{\"name\":\"complete-result\"}",
      "at": 1790263420.2399802
    },
    {
      "id": 15,
      "kind": "result_frozen",
      "body": "{\"artifact_sha256\":\"1100d0539b660acecea222af3f8facd5efd1bdbe5e035ec7efd23e5770021829\",\"name\":\"complete-result\",\"snapshot_sha256\":\"522511834dfad9476d44615efd16462c7c52f928db5d461ce1d08476f115f637\"}",
      "at": 1790263420.26444
    },
    {
      "id": 16,
      "kind": "parent_adoption",
      "body": "{\"epoch\":3,\"result\":{\"artifact_sha256\":\"1100d0539b660acecea222af3f8facd5efd1bdbe5e035ec7efd23e5770021829\",\"name\":\"complete-result\",\"snapshot_sha256\":\"522511834dfad9476d44615efd16462c7c52f928db5d461ce1d08476f115f637\"},\"scope\":\"Local synthetic target evidence\",\"worker\":\"controller-3\"}",
      "at": 1790263420.275601
    },
    {
      "id": 17,
      "kind": "local_delivery",
      "body": "{\"readback\":true,\"recipient\":\"LOCAL_NODE_INBOX\",\"result\":{\"artifact_sha256\":\"1100d0539b660acecea222af3f8facd5efd1bdbe5e035ec7efd23e5770021829\",\"name\":\"complete-result\",\"snapshot_sha256\":\"522511834dfad9476d44615efd16462c7c52f928db5d461ce1d08476f115f637\"}}",
      "at": 1790263420.2891922
    },
    {
      "id": 18,
      "kind": "local_ready",
      "body": "{\"epoch\":3,\"result\":{\"artifact_sha256\":\"1100d0539b660acecea222af3f8facd5efd1bdbe5e035ec7efd23e5770021829\",\"name\":\"complete-result\",\"snapshot_sha256\":\"522511834dfad9476d44615efd16462c7c52f928db5d461ce1d08476f115f637\"}}",
      "at": 1790263420.299207
    }
  ],
  "target_effects": [
    {
      "id": "5f6f4ec333cf43d2a4bcafd3fe9e5779",
      "tenant": "synthetic",
      "target": "original",
      "payload_hash": "3e043eef46e1b33f2389ab60efe8bb23e24f0729e4bcd16db7ef7fe0c8cb7382",
      "delta": 1,
      "epoch": 1,
      "at": 1790263419.783167
    },
    {
      "id": "9c02c1aa976540938e1de9a3091c6fb0",
      "tenant": "synthetic",
      "target": "z-independent",
      "payload_hash": "3e043eef46e1b33f2389ab60efe8bb23e24f0729e4bcd16db7ef7fe0c8cb7382",
      "delta": 1,
      "epoch": 3,
      "at": 1790263420.2109601
    }
  ],
  "limits": [
    "Local trusted operator and filesystem",
    "No remote exactly-once guarantee",
    "Foreground service has no future wake unless invoked"
  ]
}
