{"all_required_work_accounted":true,"all_required_work_verified":true,"attempts":[{"at":1790263419.7743604,"epoch":1,"id":"2b8c044d595b4c62b84cb094f415bf30","phase":"TARGET_COMMITTED","work":"5f6f4ec333cf43d2a4bcafd3fe9e5779"},{"at":1790263420.2018404,"epoch":3,"id":"290892171ef8402487076f60d5508192","phase":"TARGET_COMMITTED","work":"9c02c1aa976540938e1de9a3091c6fb0"}],"dependencies":[],"disposition_checks":{"5f6f4ec333cf43d2a4bcafd3fe9e5779":true,"9c02c1aa976540938e1de9a3091c6fb0":true},"events":[{"at":1790263419.5441108,"body":"{\"grant\":\"832d1651c6794217adf1a0a392a2449b\",\"max_effects\":1,\"target\":\"original\",\"tenant\":\"synthetic\"}","id":1,"kind":"operator_grant"},{"at":1790263419.554358,"body":"{\"grant\":\"832d1651c6794217adf1a0a392a2449b\",\"payload_hash\":\"3e043eef46e1b33f2389ab60efe8bb23e24f0729e4bcd16db7ef7fe0c8cb7382\",\"profile\":\"local-atomic\",\"work\":\"5f6f4ec333cf43d2a4bcafd3fe9e5779\"}","id":2,"kind":"admitted"},{"at":1790263419.564324,"body":"{\"grant\":\"8cf53d9d6ca9480c8e72cf30ac895781\",\"max_effects\":1,\"target\":\"z-independent\",\"tenant\":\"synthetic\"}","id":3,"kind":"operator_grant"},{"at":1790263419.574747,"body":"{\"grant\":\"8cf53d9d6ca9480c8e72cf30ac895781\",\"payload_hash\":\"3e043eef46e1b33f2389ab60efe8bb23e24f0729e4bcd16db7ef7fe0c8cb7382\",\"profile\":\"local-atomic\",\"work\":\"9c02c1aa976540938e1de9a3091c6fb0\"}","id":4,"kind":"admitted"},{"at":1790263419.7600434,"body":"{\"epoch\":1,\"worker\":\"controller-1\"}","id":5,"kind":"claim"},{"at":1790263419.7743604,"body":"{\"attempt\":\"2b8c044d595b4c62b84cb094f415bf30\",\"epoch\":1,\"work\":\"5f6f4ec333cf43d2a4bcafd3fe9e5779\"}","id":6,"kind":"dispatch_intent"},{"at":1790263419.9695878,"body":"{\"epoch\":1}","id":7,"kind":"operator_stop"},{"at":1790263419.9786186,"body":"{\"epoch\":2,\"worker\":\"controller-2\"}","id":8,"kind":"claim"},{"at":1790263419.9915824,"body":"{\"state\":\"VERIFIED\",\"work\":\"5f6f4ec333cf43d2a4bcafd3fe9e5779\"}","id":9,"kind":"reconciled"},{"at":1790263420.1743383,"body":"{\"epoch\":2}","id":10,"kind":"operator_stop"},{"at":1790263420.1840622,"body":"{\"epoch\":3,\"worker\":\"controller-3\"}","id":11,"kind":"claim"},{"at":1790263420.2018404,"body":"{\"attempt\":\"290892171ef8402487076f60d5508192\",\"epoch\":3,\"work\":\"9c02c1aa976540938e1de9a3091c6fb0\"}","id":12,"kind":"dispatch_intent"},{"at":1790263420.2266438,"body":"{\"state\":\"VERIFIED\",\"work\":\"9c02c1aa976540938e1de9a3091c6fb0\"}","id":13,"kind":"reconciled"},{"at":1790263420.2399802,"body":"{\"name\":\"complete-result\"}","id":14,"kind":"result_reservation"}],"export_is_remote_delivery":false,"export_target_checks":{"5f6f4ec333cf43d2a4bcafd3fe9e5779":true,"9c02c1aa976540938e1de9a3091c6fb0":true},"grants":[{"expires":1790267019.5431094,"id":"832d1651c6794217adf1a0a392a2449b","max_delta":10,"max_effects":1,"revoked":0,"target":"original","tenant":"synthetic"},{"expires":1790267019.5633245,"id":"8cf53d9d6ca9480c8e72cf30ac895781","max_delta":10,"max_effects":1,"revoked":0,"target":"z-independent","tenant":"synthetic"}],"limits":["Local trusted operator and filesystem","No remote exactly-once guarantee","Foreground service has no future wake unless invoked"],"node":"0e5538ce8a024e5d87cb97e83f4cfbab","observations":[{"at":1790263419.9915824,"evidence":"{\"at\":1790263419.783167,\"delta\":1,\"epoch\":1,\"id\":\"5f6f4ec333cf43d2a4bcafd3fe9e5779\",\"payload_hash\":\"3e043eef46e1b33f2389ab60efe8bb23e24f0729e4bcd16db7ef7fe0c8cb7382\",\"target\":\"original\",\"tenant\":\"synthetic\"}","id":1,"kind":"VERIFIED","work":"5f6f4ec333cf43d2a4bcafd3fe9e5779"},{"at":1790263420.2266438,"evidence":"{\"at\":1790263420.2109601,\"delta\":1,\"epoch\":3,\"id\":\"9c02c1aa976540938e1de9a3091c6fb0\",\"payload_hash\":\"3e043eef46e1b33f2389ab60efe8bb23e24f0729e4bcd16db7ef7fe0c8cb7382\",\"target\":\"z-independent\",\"tenant\":\"synthetic\"}","id":2,"kind":"VERIFIED","work":"9c02c1aa976540938e1de9a3091c6fb0"}],"owner":{"epoch":3,"singleton":1,"stopped":0,"worker":"controller-3"},"schema":1,"snapshot_at":1790263420.2471344,"target_effects":[{"at":1790263419.783167,"delta":1,"epoch":1,"id":"5f6f4ec333cf43d2a4bcafd3fe9e5779","payload_hash":"3e043eef46e1b33f2389ab60efe8bb23e24f0729e4bcd16db7ef7fe0c8cb7382","target":"original","tenant":"synthetic"},{"at":1790263420.2109601,"delta":1,"epoch":3,"id":"9c02c1aa976540938e1de9a3091c6fb0","payload_hash":"3e043eef46e1b33f2389ab60efe8bb23e24f0729e4bcd16db7ef7fe0c8cb7382","target":"z-independent","tenant":"synthetic"}],"waits":[],"works":[{"attempts":1,"budget":3,"deadline":1790263719.554358,"grant_id":"832d1651c6794217adf1a0a392a2449b","id":"5f6f4ec333cf43d2a4bcafd3fe9e5779","payload":"{\"delta\":1,\"operation\":\"increment\"}","payload_hash":"3e043eef46e1b33f2389ab60efe8bb23e24f0729e4bcd16db7ef7fe0c8cb7382","profile":"local-atomic","state":"VERIFIED","target":"original","tenant":"synthetic"},{"attempts":1,"budget":3,"deadline":1790263719.5737386,"grant_id":"8cf53d9d6ca9480c8e72cf30ac895781","id":"9c02c1aa976540938e1de9a3091c6fb0","payload":"{\"delta\":1,\"operation\":\"increment\"}","payload_hash":"3e043eef46e1b33f2389ab60efe8bb23e24f0729e4bcd16db7ef7fe0c8cb7382","profile":"local-atomic","state":"VERIFIED","target":"z-independent","tenant":"synthetic"}]}
