{"all_required_work_accounted":true,"all_required_work_verified":true,"attempts":[{"at":1790263417.4341908,"epoch":1,"id":"c2f973651d2a44a79adc86f809eccd42","phase":"TARGET_COMMITTED","work":"0eecc93529864fc88e8d2b548b43f128"},{"at":1790263417.6824315,"epoch":2,"id":"d3b34a90c3894361a13e6f2f36243115","phase":"TARGET_COMMITTED","work":"a9d746f705a1411b9d0b6e775a1ef9ae"}],"dependencies":[],"disposition_checks":{"0eecc93529864fc88e8d2b548b43f128":true,"a9d746f705a1411b9d0b6e775a1ef9ae":true},"events":[{"at":1790263417.1963303,"body":"{\"grant\":\"c488c735ed1a4678a797e4442ad91420\",\"max_effects\":1,\"target\":\"original\",\"tenant\":\"synthetic\"}","id":1,"kind":"operator_grant"},{"at":1790263417.206329,"body":"{\"grant\":\"c488c735ed1a4678a797e4442ad91420\",\"payload_hash\":\"3e043eef46e1b33f2389ab60efe8bb23e24f0729e4bcd16db7ef7fe0c8cb7382\",\"profile\":\"local-atomic\",\"work\":\"0eecc93529864fc88e8d2b548b43f128\"}","id":2,"kind":"admitted"},{"at":1790263417.2179117,"body":"{\"grant\":\"919a2529ba984e77a5e9932806069212\",\"max_effects\":1,\"target\":\"z-independent\",\"tenant\":\"synthetic\"}","id":3,"kind":"operator_grant"},{"at":1790263417.2282379,"body":"{\"grant\":\"919a2529ba984e77a5e9932806069212\",\"payload_hash\":\"3e043eef46e1b33f2389ab60efe8bb23e24f0729e4bcd16db7ef7fe0c8cb7382\",\"profile\":\"local-atomic\",\"work\":\"a9d746f705a1411b9d0b6e775a1ef9ae\"}","id":4,"kind":"admitted"},{"at":1790263417.4202366,"body":"{\"epoch\":1,\"worker\":\"controller-1\"}","id":5,"kind":"claim"},{"at":1790263417.4341908,"body":"{\"attempt\":\"c2f973651d2a44a79adc86f809eccd42\",\"epoch\":1,\"work\":\"0eecc93529864fc88e8d2b548b43f128\"}","id":6,"kind":"dispatch_intent"},{"at":1790263417.6438136,"body":"{\"epoch\":1}","id":7,"kind":"operator_stop"},{"at":1790263417.6531422,"body":"{\"epoch\":2,\"worker\":\"controller-2\"}","id":8,"kind":"claim"},{"at":1790263417.6684499,"body":"{\"state\":\"VERIFIED\",\"work\":\"0eecc93529864fc88e8d2b548b43f128\"}","id":9,"kind":"reconciled"},{"at":1790263417.6824315,"body":"{\"attempt\":\"d3b34a90c3894361a13e6f2f36243115\",\"epoch\":2,\"work\":\"a9d746f705a1411b9d0b6e775a1ef9ae\"}","id":10,"kind":"dispatch_intent"},{"at":1790263417.7183692,"body":"{\"state\":\"VERIFIED\",\"work\":\"a9d746f705a1411b9d0b6e775a1ef9ae\"}","id":11,"kind":"reconciled"},{"at":1790263417.7318082,"body":"{\"name\":\"complete-result\"}","id":12,"kind":"result_reservation"}],"export_is_remote_delivery":false,"export_target_checks":{"0eecc93529864fc88e8d2b548b43f128":true,"a9d746f705a1411b9d0b6e775a1ef9ae":true},"grants":[{"expires":1790267017.195329,"id":"c488c735ed1a4678a797e4442ad91420","max_delta":10,"max_effects":1,"revoked":0,"target":"original","tenant":"synthetic"},{"expires":1790267017.2179117,"id":"919a2529ba984e77a5e9932806069212","max_delta":10,"max_effects":1,"revoked":0,"target":"z-independent","tenant":"synthetic"}],"limits":["Local trusted operator and filesystem","No remote exactly-once guarantee","Foreground service has no future wake unless invoked"],"node":"8855468a247944a9aff9cd316d7b8b73","observations":[{"at":1790263417.6684499,"evidence":"{\"at\":1790263417.4441953,\"delta\":1,\"epoch\":1,\"id\":\"0eecc93529864fc88e8d2b548b43f128\",\"payload_hash\":\"3e043eef46e1b33f2389ab60efe8bb23e24f0729e4bcd16db7ef7fe0c8cb7382\",\"target\":\"original\",\"tenant\":\"synthetic\"}","id":1,"kind":"VERIFIED","work":"0eecc93529864fc88e8d2b548b43f128"},{"at":1790263417.7173688,"evidence":"{\"at\":1790263417.6921148,\"delta\":1,\"epoch\":2,\"id\":\"a9d746f705a1411b9d0b6e775a1ef9ae\",\"payload_hash\":\"3e043eef46e1b33f2389ab60efe8bb23e24f0729e4bcd16db7ef7fe0c8cb7382\",\"target\":\"z-independent\",\"tenant\":\"synthetic\"}","id":2,"kind":"VERIFIED","work":"a9d746f705a1411b9d0b6e775a1ef9ae"}],"owner":{"epoch":2,"singleton":1,"stopped":0,"worker":"controller-2"},"schema":1,"snapshot_at":1790263417.7403235,"target_effects":[{"at":1790263417.4441953,"delta":1,"epoch":1,"id":"0eecc93529864fc88e8d2b548b43f128","payload_hash":"3e043eef46e1b33f2389ab60efe8bb23e24f0729e4bcd16db7ef7fe0c8cb7382","target":"original","tenant":"synthetic"},{"at":1790263417.6921148,"delta":1,"epoch":2,"id":"a9d746f705a1411b9d0b6e775a1ef9ae","payload_hash":"3e043eef46e1b33f2389ab60efe8bb23e24f0729e4bcd16db7ef7fe0c8cb7382","target":"z-independent","tenant":"synthetic"}],"waits":[],"works":[{"attempts":1,"budget":3,"deadline":1790263717.2053292,"grant_id":"c488c735ed1a4678a797e4442ad91420","id":"0eecc93529864fc88e8d2b548b43f128","payload":"{\"delta\":1,\"operation\":\"increment\"}","payload_hash":"3e043eef46e1b33f2389ab60efe8bb23e24f0729e4bcd16db7ef7fe0c8cb7382","profile":"local-atomic","state":"VERIFIED","target":"original","tenant":"synthetic"},{"attempts":1,"budget":3,"deadline":1790263717.227133,"grant_id":"919a2529ba984e77a5e9932806069212","id":"a9d746f705a1411b9d0b6e775a1ef9ae","payload":"{\"delta\":1,\"operation\":\"increment\"}","payload_hash":"3e043eef46e1b33f2389ab60efe8bb23e24f0729e4bcd16db7ef7fe0c8cb7382","profile":"local-atomic","state":"VERIFIED","target":"z-independent","tenant":"synthetic"}]}
